{
  "array_file": "rope.npz",
  "arrays": {
    "expected.gradient.input.x": {
      "axes": [
        "batch",
        "sequence",
        "feature"
      ],
      "dtype": "float32",
      "finiteness": "required",
      "physical_representation": "dense",
      "role": "expected_input_gradient",
      "shape": [
        2,
        3,
        8
      ]
    },
    "expected.output": {
      "axes": [
        "batch",
        "sequence",
        "feature"
      ],
      "dtype": "float32",
      "finiteness": "required",
      "physical_representation": "dense",
      "role": "expected_output",
      "shape": [
        2,
        3,
        8
      ]
    },
    "input.positions": {
      "axes": [
        "batch",
        "sequence"
      ],
      "dtype": "int64",
      "finiteness": "not_applicable",
      "physical_representation": "dense",
      "role": "input",
      "shape": [
        2,
        3
      ],
      "zero_based_values": true
    },
    "input.x": {
      "axes": [
        "batch",
        "sequence",
        "feature"
      ],
      "dtype": "float32",
      "finiteness": "required",
      "physical_representation": "dense",
      "role": "input",
      "shape": [
        2,
        3,
        8
      ]
    }
  },
  "contract_version": 1,
  "gradients": {
    "objective": "sum(expected.output ** 2)",
    "physical_representation": "dense",
    "present": true
  },
  "notes": [
    "Output and input gradient are produced through tests.adapters.run_rope.",
    "Positions are deliberately non-consecutive and differ by batch."
  ],
  "operation": "run_rope",
  "producer": {
    "language": "Python",
    "packages": {
      "numpy": "2.4.4",
      "torch": "2.11.0+cpu"
    },
    "runtime_version": "26.0.0"
  },
  "scalars": {
    "d_k": 8,
    "max_seq_len": 6,
    "theta": 10000.0
  },
  "source": {
    "generated_at": "2026-07-23T02:49:42+08:00",
    "git_commit": "04cac655b28b893f1eb82f414facc36c3ca26fa4",
    "working_tree_clean": true
  },
  "tolerances": {
    "atol": 2e-06,
    "equal_nan": false,
    "rtol": 2e-06
  }
}
