{
  "array_file": "swiglu.npz",
  "arrays": {
    "expected.gradient.input.x": {
      "axes": [
        "batch",
        "sequence",
        "model_feature"
      ],
      "dtype": "float32",
      "finiteness": "required",
      "physical_representation": "dense",
      "role": "expected_input_gradient",
      "shape": [
        2,
        3,
        4
      ]
    },
    "expected.gradient.parameter.w1": {
      "axes": [
        "hidden_feature",
        "model_feature"
      ],
      "dtype": "float32",
      "finiteness": "required",
      "physical_representation": "dense",
      "role": "expected_parameter_gradient",
      "shape": [
        6,
        4
      ]
    },
    "expected.gradient.parameter.w2": {
      "axes": [
        "model_feature",
        "hidden_feature"
      ],
      "dtype": "float32",
      "finiteness": "required",
      "physical_representation": "dense",
      "role": "expected_parameter_gradient",
      "shape": [
        4,
        6
      ]
    },
    "expected.gradient.parameter.w3": {
      "axes": [
        "hidden_feature",
        "model_feature"
      ],
      "dtype": "float32",
      "finiteness": "required",
      "physical_representation": "dense",
      "role": "expected_parameter_gradient",
      "shape": [
        6,
        4
      ]
    },
    "expected.output": {
      "axes": [
        "batch",
        "sequence",
        "model_feature"
      ],
      "dtype": "float32",
      "finiteness": "required",
      "physical_representation": "dense",
      "role": "expected_output",
      "shape": [
        2,
        3,
        4
      ]
    },
    "input.x": {
      "axes": [
        "batch",
        "sequence",
        "model_feature"
      ],
      "dtype": "float32",
      "finiteness": "required",
      "physical_representation": "dense",
      "role": "input",
      "shape": [
        2,
        3,
        4
      ]
    },
    "parameter.w1": {
      "axes": [
        "hidden_feature",
        "model_feature"
      ],
      "dtype": "float32",
      "finiteness": "required",
      "physical_representation": "dense",
      "role": "parameter",
      "shape": [
        6,
        4
      ]
    },
    "parameter.w2": {
      "axes": [
        "model_feature",
        "hidden_feature"
      ],
      "dtype": "float32",
      "finiteness": "required",
      "physical_representation": "dense",
      "role": "parameter",
      "shape": [
        4,
        6
      ]
    },
    "parameter.w3": {
      "axes": [
        "hidden_feature",
        "model_feature"
      ],
      "dtype": "float32",
      "finiteness": "required",
      "physical_representation": "dense",
      "role": "parameter",
      "shape": [
        6,
        4
      ]
    }
  },
  "contract_version": 1,
  "gradients": {
    "objective": "sum(expected.output ** 2)",
    "physical_representation": "dense",
    "present": true
  },
  "notes": [
    "Output is verified through tests.adapters.run_swiglu.",
    "The selected Python module uses one packed value/gate GEMM; its gradient is unpacked into semantic w3/w1 arrays.",
    "Julia keeps semantic weights explicit, so contraction-order roundoff is covered by the declared tolerance."
  ],
  "operation": "run_swiglu",
  "producer": {
    "language": "Python",
    "packages": {
      "numpy": "2.4.4",
      "torch": "2.11.0+cpu"
    },
    "runtime_version": "26.0.0"
  },
  "scalars": {
    "d_ff": 6,
    "d_model": 4
  },
  "source": {
    "generated_at": "2026-07-23T00:55:12+08:00",
    "git_commit": "64bb862266d73565d66e3dc756e89f15f875b04e",
    "working_tree_clean": true
  },
  "tolerances": {
    "atol": 1e-06,
    "equal_nan": false,
    "rtol": 1e-05
  }
}
