{
  "array_file": "linear.npz",
  "arrays": {
    "expected.gradient.input.x": {
      "axes": [
        "batch",
        "sequence",
        "input_feature"
      ],
      "dtype": "float32",
      "finiteness": "required",
      "physical_representation": "dense",
      "role": "expected_input_gradient",
      "shape": [
        2,
        3,
        4
      ]
    },
    "expected.gradient.parameter.weight": {
      "axes": [
        "output_feature",
        "input_feature"
      ],
      "dtype": "float32",
      "finiteness": "required",
      "physical_representation": "dense",
      "role": "expected_parameter_gradient",
      "shape": [
        3,
        4
      ]
    },
    "expected.output": {
      "axes": [
        "batch",
        "sequence",
        "output_feature"
      ],
      "dtype": "float32",
      "finiteness": "required",
      "physical_representation": "dense",
      "role": "expected_output",
      "shape": [
        2,
        3,
        3
      ]
    },
    "input.x": {
      "axes": [
        "batch",
        "sequence",
        "input_feature"
      ],
      "dtype": "float32",
      "finiteness": "required",
      "physical_representation": "dense",
      "role": "input",
      "shape": [
        2,
        3,
        4
      ]
    },
    "parameter.weight": {
      "axes": [
        "output_feature",
        "input_feature"
      ],
      "dtype": "float32",
      "finiteness": "required",
      "physical_representation": "dense",
      "role": "parameter",
      "shape": [
        3,
        4
      ]
    }
  },
  "contract_version": 1,
  "gradients": {
    "objective": "sum(expected.output ** 2)",
    "physical_representation": "dense",
    "present": true
  },
  "notes": [
    "Output is produced through tests.adapters.run_linear.",
    "Gradients use the same CS336 Linear module because load_state_dict intentionally severs the source tensor graph."
  ],
  "operation": "run_linear",
  "producer": {
    "language": "Python",
    "packages": {
      "numpy": "2.4.4",
      "torch": "2.11.0+cpu"
    },
    "runtime_version": "26.0.0"
  },
  "scalars": {
    "d_in": 4,
    "d_out": 3
  },
  "source": {
    "generated_at": "2026-07-23T00:21:03+08:00",
    "git_commit": "e61cc891096fa447f807a68f330ac27d7f33d75a",
    "working_tree_clean": true
  },
  "tolerances": {
    "atol": 1e-06,
    "equal_nan": false,
    "rtol": 1e-06
  }
}
