{
  "array_file": "transformer_block.npz",
  "arrays": {
    "expected.gradient.input.x": {
      "axes": [
        "batch",
        "sequence",
        "model_feature"
      ],
      "dtype": "float32",
      "finiteness": "required",
      "physical_representation": "dense",
      "role": "expected_input_gradient",
      "shape": [
        2,
        4,
        8
      ]
    },
    "expected.gradient.parameter.attention_norm": {
      "axes": [
        "model_feature"
      ],
      "dtype": "float32",
      "finiteness": "required",
      "physical_representation": "dense",
      "role": "expected_parameter_gradient",
      "shape": [
        8
      ]
    },
    "expected.gradient.parameter.attention_output_weight": {
      "axes": [
        "projected_feature",
        "input_feature"
      ],
      "dtype": "float32",
      "finiteness": "required",
      "physical_representation": "dense",
      "role": "expected_parameter_gradient",
      "shape": [
        8,
        8
      ]
    },
    "expected.gradient.parameter.feed_forward_norm": {
      "axes": [
        "model_feature"
      ],
      "dtype": "float32",
      "finiteness": "required",
      "physical_representation": "dense",
      "role": "expected_parameter_gradient",
      "shape": [
        8
      ]
    },
    "expected.gradient.parameter.key_weight": {
      "axes": [
        "projected_feature",
        "input_feature"
      ],
      "dtype": "float32",
      "finiteness": "required",
      "physical_representation": "dense",
      "role": "expected_parameter_gradient",
      "shape": [
        8,
        8
      ]
    },
    "expected.gradient.parameter.query_weight": {
      "axes": [
        "projected_feature",
        "input_feature"
      ],
      "dtype": "float32",
      "finiteness": "required",
      "physical_representation": "dense",
      "role": "expected_parameter_gradient",
      "shape": [
        8,
        8
      ]
    },
    "expected.gradient.parameter.value_weight": {
      "axes": [
        "projected_feature",
        "input_feature"
      ],
      "dtype": "float32",
      "finiteness": "required",
      "physical_representation": "dense",
      "role": "expected_parameter_gradient",
      "shape": [
        8,
        8
      ]
    },
    "expected.gradient.parameter.w1": {
      "axes": [
        "feed_forward_feature",
        "model_feature"
      ],
      "dtype": "float32",
      "finiteness": "required",
      "physical_representation": "dense",
      "role": "expected_parameter_gradient",
      "shape": [
        16,
        8
      ]
    },
    "expected.gradient.parameter.w2": {
      "axes": [
        "model_feature",
        "feed_forward_feature"
      ],
      "dtype": "float32",
      "finiteness": "required",
      "physical_representation": "dense",
      "role": "expected_parameter_gradient",
      "shape": [
        8,
        16
      ]
    },
    "expected.gradient.parameter.w3": {
      "axes": [
        "feed_forward_feature",
        "model_feature"
      ],
      "dtype": "float32",
      "finiteness": "required",
      "physical_representation": "dense",
      "role": "expected_parameter_gradient",
      "shape": [
        16,
        8
      ]
    },
    "expected.output": {
      "axes": [
        "batch",
        "sequence",
        "model_feature"
      ],
      "dtype": "float32",
      "finiteness": "required",
      "physical_representation": "dense",
      "role": "expected_output",
      "shape": [
        2,
        4,
        8
      ]
    },
    "input.x": {
      "axes": [
        "batch",
        "sequence",
        "model_feature"
      ],
      "dtype": "float32",
      "finiteness": "required",
      "physical_representation": "dense",
      "role": "input",
      "shape": [
        2,
        4,
        8
      ]
    },
    "parameter.attention_norm": {
      "axes": [
        "model_feature"
      ],
      "dtype": "float32",
      "finiteness": "required",
      "physical_representation": "dense",
      "role": "parameter",
      "shape": [
        8
      ]
    },
    "parameter.attention_output_weight": {
      "axes": [
        "projected_feature",
        "input_feature"
      ],
      "dtype": "float32",
      "finiteness": "required",
      "physical_representation": "dense",
      "role": "parameter",
      "shape": [
        8,
        8
      ]
    },
    "parameter.feed_forward_norm": {
      "axes": [
        "model_feature"
      ],
      "dtype": "float32",
      "finiteness": "required",
      "physical_representation": "dense",
      "role": "parameter",
      "shape": [
        8
      ]
    },
    "parameter.key_weight": {
      "axes": [
        "projected_feature",
        "input_feature"
      ],
      "dtype": "float32",
      "finiteness": "required",
      "physical_representation": "dense",
      "role": "parameter",
      "shape": [
        8,
        8
      ]
    },
    "parameter.query_weight": {
      "axes": [
        "projected_feature",
        "input_feature"
      ],
      "dtype": "float32",
      "finiteness": "required",
      "physical_representation": "dense",
      "role": "parameter",
      "shape": [
        8,
        8
      ]
    },
    "parameter.value_weight": {
      "axes": [
        "projected_feature",
        "input_feature"
      ],
      "dtype": "float32",
      "finiteness": "required",
      "physical_representation": "dense",
      "role": "parameter",
      "shape": [
        8,
        8
      ]
    },
    "parameter.w1": {
      "axes": [
        "feed_forward_feature",
        "model_feature"
      ],
      "dtype": "float32",
      "finiteness": "required",
      "physical_representation": "dense",
      "role": "parameter",
      "shape": [
        16,
        8
      ]
    },
    "parameter.w2": {
      "axes": [
        "model_feature",
        "feed_forward_feature"
      ],
      "dtype": "float32",
      "finiteness": "required",
      "physical_representation": "dense",
      "role": "parameter",
      "shape": [
        8,
        16
      ]
    },
    "parameter.w3": {
      "axes": [
        "feed_forward_feature",
        "model_feature"
      ],
      "dtype": "float32",
      "finiteness": "required",
      "physical_representation": "dense",
      "role": "parameter",
      "shape": [
        16,
        8
      ]
    }
  },
  "contract_version": 1,
  "gradients": {
    "objective": "sum(expected.output ** 2)",
    "physical_representation": "dense",
    "present": true
  },
  "notes": [
    "Forward values are checked exactly against tests.adapters.run_transformer_block.",
    "Packed Python attention and SwiGLU gradients are unpacked into semantic arrays."
  ],
  "operation": "run_transformer_block",
  "producer": {
    "language": "Python",
    "packages": {
      "numpy": "2.4.4",
      "torch": "2.11.0+cpu"
    },
    "runtime_version": "26.0.0"
  },
  "scalars": {
    "context_length": 6,
    "d_ff": 16,
    "d_model": 8,
    "num_heads": 2,
    "theta": 10000.0
  },
  "source": {
    "generated_at": "2026-07-23T03:21:09+08:00",
    "git_commit": "e6101e1ebf9620abc7ad022e59c81d09e7091999",
    "working_tree_clean": true
  },
  "tolerances": {
    "atol": 0.0001,
    "equal_nan": false,
    "rtol": 0.0001
  }
}
